name,type,levels,description,source,is_derived
permission_issuer,character,Journal; Publisher; article; journal,Organization issuing the permission to archive the publication. Only where `has_publication` is TRUE and a DOI was found. From `type` under `issuer` (best permission) in the Shareyourpaper API response. NA where `type` under `issuer` (best permission) is not returned in the Shareyourpaper API response on the query date.,shareyourpaper,FALSE
embargo,numeric,NA,Embargo (in months) of the best permission to archive the publication. Only where `has_publication` is TRUE and a DOI was found. From `embargo_months` (best permission) in the Shareyourpaper API response. NA where `embargo_months` (best permission) is not returned in the Shareyourpaper API response on the query date.,shareyourpaper,FALSE
date_embargo_elapsed,date,NA,Date at which the embargo elapses (if any). Only where `has_publication` is TRUE and a DOI was found. From `embargo_end` (best permission) in the Shareyourpaper API response. NA where `embargo_months` (best permission) equals 0 or is not returned in the Shareyourpaper API response on the query date.,shareyourpaper,FALSE
is_embargo_elapsed,logical,NA,Whether the embargo (if any) elapsed by the query date. Only where `has_publication` is TRUE and a DOI was found. TRUE if `embargo` equals 0 or `date_embargo_elapsed` is before the query date. FALSE if `date_embargo_elapsed` is after the query date. NA where `embargo` is not returned in the Shareyourpaper API response on the query date.,shareyourpaper,TRUE
permission_accepted,logical,NA,"Whether the accepted version of the publication be archived in an institutional repository, based on the best permission in the Shareyourpaper API response at the query date. Only where `has_publication` is TRUE and a DOI was found. TRUE if `can_archive`, `inst_repository`, `is_embargo_elapsed`, and `accepted_version` are all TRUE. NA if any of `can_archive`, `inst_repository`, `is_embargo_elapsed`, or `accepted_version` is NA. Otherwise FALSE.",shareyourpaper,TRUE
permission_published,logical,NA,"Whether the published version of the publication be archived in an institutional repository, based on the best permission in the Shareyourpaper API response at the query date. Only where `has_publication` is TRUE and a DOI was found. TRUE if `can_archive`, `inst_repository`, `is_embargo_elapsed`, and `published_version` are all TRUE. NA if any of `can_archive`, `inst_repository`, `is_embargo_elapsed`, or `published_version` is NA. Otherwise FALSE.",shareyourpaper,TRUE
is_oa,logical,NA,"Whether the publication is openly available. Derived from `color`. Only where `has_publication` is TRUE and a DOI was found. TRUE if `color` is ""gold"", ""hybrid"", ""green"", or ""bronze"". FALSE if `color` is ""closed"". NA where `color` is NA.",unpaywall,TRUE
is_archivable,logical,NA,"Whether the publication can be archived, regardless of OA status. Only where `has_publication` is TRUE and a DOI was found. TRUE if either `permission_accepted` or `permission_published` is TRUE. FALSE if both `permission_accepted` and `permission_published` are FALSE. Otherwise NA.",unpaywall,TRUE
is_closed_archivable,logical,NA,"Whether paywalled publications can be archived. Only where `has_publication` is TRUE and a DOI was found. Where `color` is ""closed"", corresponds to `is_archivable`. Otherwise NA.",unpaywall,TRUE
